{
  "$schema": "https://json-schema.org/draft/2020-12/schema",
  "$id": "https://calavera.schalkneethling.com/calavera.config.schema.json",
  "title": "Calavera configuration recipe",
  "description": "A repeatable project tooling recipe for create-project-calavera.",
  "type": "object",
  "additionalProperties": false,
  "required": ["version", "profile", "packageManager", "integrations", "scripts"],
  "properties": {
    "$schema": {
      "description": "The published JSON Schema for Calavera recipe files.",
      "type": "string",
      "format": "uri",
      "const": "https://calavera.schalkneethling.com/calavera.config.schema.json"
    },
    "version": {
      "description": "The Calavera recipe format version.",
      "type": "integer",
      "const": 1
    },
    "profile": {
      "description": "The base tooling profile used to compose the recipe.",
      "type": "string",
      "enum": ["default", "minimal"]
    },
    "packageManager": {
      "description": "The package manager used for dependency installation and generated scripts.",
      "type": "string",
      "enum": ["npm", "pnpm", "yarn", "bun"]
    },
    "integrations": {
      "description": "Calavera integration IDs to apply. Some integrations include their required parent integration automatically.",
      "type": "array",
      "items": {
        "$ref": "#/$defs/integrationId"
      },
      "uniqueItems": true
    },
    "integrationOptions": {
      "description": "Options keyed by selected or transitively included integration ID.",
      "type": "object",
      "additionalProperties": false,
      "properties": {
        "stylelint-baseline": {
          "$ref": "#/$defs/stylelintBaselineOptions"
        },
        "html-validate": {
          "$ref": "#/$defs/htmlValidateOptions"
        },
        "github-repository-controls": {
          "$ref": "#/$defs/githubRepositoryControlsOptions"
        }
      }
    },
    "scripts": {
      "description": "Boolean package script flags. Calavera generates scripts for known enabled flags when the selected integrations support them.",
      "type": "object",
      "additionalProperties": {
        "type": "boolean"
      },
      "properties": {
        "lint": {
          "type": "boolean",
          "description": "Generate the lint:styles script when a CSS linting integration is selected."
        },
        "lint:fix": {
          "type": "boolean",
          "description": "Generate the lint:styles:fix script when a fix-capable CSS linting integration is selected."
        },
        "quality": {
          "type": "boolean",
          "description": "Generate a combined quality script from the generated lint:styles, lint:html, Knip, React Doctor, and env:load scripts. In a Vite+-managed project, it runs vp check and the Vite+ tests first."
        }
      }
    },
    "ai": {
      "description": "Optional bundled AI skills, hooks, and agents to install under .agents/, or under .codex/agents/ when adapting agent artifacts with target codex.",
      "type": "array",
      "items": {
        "$ref": "#/$defs/aiItem"
      }
    }
  },
  "allOf": [
    {
      "if": {
        "properties": {
          "integrationOptions": {
            "type": "object",
            "required": ["stylelint-baseline"]
          }
        },
        "required": ["integrationOptions"]
      },
      "then": {
        "properties": {
          "integrations": {
            "type": "array",
            "contains": {
              "const": "stylelint-baseline"
            }
          }
        }
      }
    },
    {
      "if": {
        "properties": {
          "integrationOptions": {
            "type": "object",
            "required": ["html-validate"]
          }
        },
        "required": ["integrationOptions"]
      },
      "then": {
        "properties": {
          "integrations": {
            "type": "array",
            "contains": {
              "const": "html-validate"
            }
          }
        }
      }
    },
    {
      "if": {
        "properties": {
          "integrationOptions": {
            "type": "object",
            "required": ["github-repository-controls"]
          }
        },
        "required": ["integrationOptions"]
      },
      "then": {
        "properties": {
          "integrations": {
            "type": "array",
            "contains": {
              "const": "github-repository-controls"
            }
          }
        }
      }
    },
    {
      "if": {
        "properties": {
          "integrations": {
            "type": "array",
            "contains": {
              "const": "github-repository-controls"
            }
          }
        },
        "required": ["integrations"]
      },
      "then": {
        "required": ["integrationOptions"],
        "properties": {
          "integrationOptions": {
            "type": "object",
            "required": ["github-repository-controls"]
          }
        }
      }
    }
  ],
  "$defs": {
    "stylelintBaselineOptions": {
      "type": "object",
      "additionalProperties": false,
      "required": ["available", "severity"],
      "properties": {
        "available": {
          "description": "A moving or fixed Baseline availability target.",
          "oneOf": [
            {
              "type": "string",
              "enum": ["widely", "newly"]
            },
            {
              "type": "integer",
              "minimum": 2015,
              "maximum": 2026
            }
          ]
        },
        "severity": {
          "type": "string",
          "enum": ["warning", "error"]
        }
      }
    },
    "htmlValidateOptions": {
      "type": "object",
      "additionalProperties": false,
      "properties": {
        "quality": {
          "description": "Run lint:html in the generated quality script. Set it to false in a project without static HTML files, such as one whose HTML a server or a Worker renders, and validate the rendered HTML in tests with the HTML Validate API instead. Calavera still generates lint:html.",
          "type": "boolean",
          "default": true
        }
      }
    },
    "githubRepositoryControlsOptions": {
      "type": "object",
      "additionalProperties": false,
      "required": ["repository"],
      "properties": {
        "repository": {
          "type": "string",
          "pattern": "^[A-Za-z0-9_.-]+/[A-Za-z0-9_.-]+$"
        },
        "defaultBranch": {
          "type": "string",
          "minLength": 1,
          "default": "main"
        },
        "requiredChecks": {
          "type": "array",
          "uniqueItems": true,
          "items": { "type": "string", "minLength": 1 },
          "default": []
        },
        "requireCodeqlResults": { "type": "boolean", "default": true },
        "mergeMethods": {
          "type": "array",
          "minItems": 1,
          "uniqueItems": true,
          "items": { "type": "string", "enum": ["merge", "squash", "rebase"] },
          "default": ["squash"]
        },
        "wiki": { "type": "boolean", "default": false },
        "projects": { "type": "boolean", "default": false },
        "autoMerge": { "type": "boolean", "default": true },
        "deleteBranchOnMerge": { "type": "boolean", "default": true },
        "updateBranch": { "type": "boolean", "default": true },
        "dependabotEcosystems": {
          "type": "array",
          "minItems": 1,
          "uniqueItems": true,
          "items": { "type": "string", "enum": ["npm", "github-actions"] },
          "default": ["npm", "github-actions"]
        },
        "codeqlLanguages": {
          "type": "array",
          "minItems": 1,
          "uniqueItems": true,
          "items": {
            "type": "string",
            "enum": [
              "actions",
              "c-cpp",
              "csharp",
              "go",
              "java-kotlin",
              "javascript-typescript",
              "python",
              "ruby",
              "swift"
            ]
          },
          "default": ["actions", "javascript-typescript"]
        },
        "codeqlQuerySuite": {
          "type": "string",
          "enum": ["default", "extended"],
          "default": "extended"
        },
        "releaseEnvironment": {
          "oneOf": [
            { "const": false },
            { "type": "null" },
            {
              "type": "object",
              "additionalProperties": false,
              "required": ["reviewers"],
              "properties": {
                "name": { "type": "string", "minLength": 1, "default": "release" },
                "reviewers": {
                  "type": "array",
                  "minItems": 1,
                  "uniqueItems": true,
                  "items": { "type": "string", "minLength": 1 }
                },
                "waitTimer": {
                  "type": "integer",
                  "minimum": 0,
                  "maximum": 43200,
                  "default": 0
                },
                "preventSelfReview": { "type": "boolean", "default": false },
                "branches": {
                  "type": "array",
                  "minItems": 1,
                  "uniqueItems": true,
                  "items": { "type": "string", "minLength": 1 }
                }
              }
            }
          ],
          "default": false
        }
      }
    },
    "integrationId": {
      "type": "string",
      "enum": [
        "editorconfig",
        "knip",
        "html-validate",
        "varlock",
        "github-repository-controls",
        "react-doctor",
        "stylelint",
        "stylelint-standard",
        "stylelint-order",
        "stylelint-baseline",
        "stylelint-scss",
        "stylelint-stylistic",
        "stylelint-logical-css",
        "css-property-type-validator"
      ]
    },
    "aiItem": {
      "oneOf": [
        {
          "$ref": "#/$defs/artifactSelection"
        },
        {
          "$ref": "#/$defs/legacyAiItem"
        }
      ]
    },
    "artifactSelection": {
      "type": "object",
      "additionalProperties": false,
      "required": ["id"],
      "properties": {
        "id": {
          "type": "string",
          "pattern": "^(?:skill|hook|agent)-[a-z0-9]+(?:-[a-z0-9]+)*$"
        },
        "target": {
          "type": "string",
          "minLength": 1,
          "pattern": "^(?!(?:\\.|\\.\\.)$)[^/\\\\]+$"
        },
        "inputs": {
          "description": "Answers to the inputs the artifact declares, such as the protected branch of skill-protected-branch-guard. Calavera checks each value against the artifact's declaration before it applies the recipe.",
          "type": "object",
          "minProperties": 1,
          "propertyNames": { "pattern": "^[a-z][A-Za-z0-9]*$" },
          "additionalProperties": {
            "type": "string",
            "minLength": 1
          }
        }
      },
      "allOf": [
        {
          "if": {
            "properties": {
              "id": {
                "type": "string",
                "pattern": "^skill-"
              }
            },
            "required": ["id"]
          },
          "then": {
            "not": {
              "required": ["target"]
            }
          }
        }
      ]
    },
    "legacyAiItem": {
      "type": "object",
      "additionalProperties": false,
      "required": ["type", "src"],
      "properties": {
        "type": {
          "description": "The bundled AI artifact type.",
          "type": "string",
          "enum": ["skill", "hook", "agent"]
        },
        "src": {
          "description": "Legacy artifact path resolved through the first-party package catalog.",
          "type": "string",
          "minLength": 1
        },
        "target": {
          "description": "Output target directory name for hook and agent artifacts. Use target codex on agent artifacts to generate Codex custom-agent TOML under .codex/agents/. Skill artifacts do not use target.",
          "type": "string",
          "minLength": 1,
          "pattern": "^(?!(?:\\.|\\.\\.)$)[^/\\\\]+$"
        }
      },
      "allOf": [
        {
          "if": {
            "properties": { "type": { "const": "skill" } },
            "required": ["type"]
          },
          "then": {
            "properties": { "src": { "type": "string", "pattern": "^skills/[^/\\\\]+$" } }
          }
        },
        {
          "if": {
            "properties": { "type": { "const": "hook" } },
            "required": ["type"]
          },
          "then": {
            "properties": { "src": { "type": "string", "pattern": "^hooks/[^/\\\\]+$" } }
          }
        },
        {
          "if": {
            "properties": { "type": { "const": "agent" } },
            "required": ["type"]
          },
          "then": {
            "properties": { "src": { "type": "string", "pattern": "^agents/[^/\\\\]+\\.md$" } }
          }
        },
        {
          "if": {
            "properties": {
              "type": {
                "const": "skill"
              }
            },
            "required": ["type"]
          },
          "then": {
            "not": {
              "required": ["target"]
            }
          }
        }
      ]
    }
  }
}
