{
  "$schema": "https://calavera.schalkneethling.com/calavera.config.schema.json",
  "version": 1,
  "profile": "default",
  "packageManager": "pnpm",
  "integrations": [
    "editorconfig",
    "stylelint",
    "stylelint-standard",
    "stylelint-order",
    "stylelint-baseline",
    "css-property-type-validator"
  ],
  "scripts": {
    "lint": true,
    "lint:fix": true,
    "quality": true
  }
}
